{
  "$schema": "https://json-schema.org/draft/2020-12/schema",
  "$id": "https://timetoalign.github.io/timeskeleton/0.7.0/group.schema.json",
  "title": "TimeSkeleton group file",
  "description": "A TimeSkeleton 0.7.0 group file: one timeline group and the timelines it names, self-contained. A group is an array of member timelines that share, by definition, the same graphical start and end: every member's 0 coincides with every other member's 0 and every member's length with every other member's length, and positions in between convert linearly. When only part of a timeline takes part, the member is a child of that timeline, placed at its exact offset; a member is never placed partially. The group names its members by id; each id names a timeline of the file's timelines array, a root or a descendant at any depth, and every root contains at least one member. Timeline ids, roots and descendants alike, are unique across the file, and the group id differs from every timeline id; every other id is unique within its own timeline manifest, as in a timeline file. The timelines and the members are sorted by id in code-point order, and readers accept any order; the members' display order is presentation and lives in graphical.order. Object keys carry no order and are written sorted by code point.",
  "type": "object",
  "properties": {
    "meta": {
      "$ref": "core.schema.json#/$defs/Meta"
    },
    "timelines": {
      "type": "array",
      "description": "The root timelines of the file, each a complete timeline manifest with all its descendants, sorted by id. Each one is a member or contains a member.",
      "items": {
        "$ref": "timeline.schema.json#/$defs/TimelineManifest"
      }
    },
    "group": {
      "$ref": "#/$defs/Group"
    },
    "graphical": {
      "$ref": "#/$defs/GroupGraphical"
    }
  },
  "required": [
    "meta",
    "timelines",
    "group"
  ],
  "additionalProperties": false,
  "$defs": {
    "Group": {
      "type": "object",
      "description": "A timeline group: member timelines sharing the same graphical start and end, named by id. The bundle document refers to this definition for its groups.",
      "properties": {
        "id": {
          "$ref": "core.schema.json#/$defs/Id",
          "description": "The group id, unique among the file's groups and different from every timeline id of the file."
        },
        "name": {
          "type": [
            "string",
            "null"
          ],
          "description": "Human-readable name, or null when none was given."
        },
        "meta": {
          "type": "object",
          "description": "Free-form metadata."
        },
        "members": {
          "type": "array",
          "description": "The ids of the member timelines, sorted by code point, each naming a timeline of the file's timelines array: a root or a descendant at any depth. The array may be empty.",
          "items": {
            "$ref": "core.schema.json#/$defs/Id"
          },
          "uniqueItems": true
        }
      },
      "required": [
        "id",
        "name",
        "meta",
        "members"
      ],
      "additionalProperties": false
    },
    "MemberOrder": {
      "type": "array",
      "description": "The display order of one group's members: a permutation of its members. It is never re-ordered by a writer.",
      "items": {
        "$ref": "core.schema.json#/$defs/Id"
      },
      "uniqueItems": true
    },
    "GroupGraphical": {
      "type": "object",
      "description": "The presentation of the group file.",
      "properties": {
        "order": {
          "$ref": "#/$defs/MemberOrder",
          "description": "The display order of the group's members, a permutation of group.members. Without it, the members are displayed in the order of group.members."
        }
      },
      "additionalProperties": false
    }
  }
}
