{
  "graphical": {
    "order": [
      "cpt_1",
      "cpt_2",
      "cpt_3",
      "cpt_4",
      "cpt_5",
      "cpt_6",
      "cpt_7"
    ]
  },
  "group": {
    "id": "tilia:Bruckner5_Scherzo",
    "members": [
      "cpt_1",
      "cpt_2",
      "cpt_3",
      "cpt_4",
      "cpt_5",
      "cpt_6",
      "cpt_7"
    ],
    "meta": {},
    "name": "Bruckner5_Scherzo"
  },
  "meta": {
    "generator": "timetoalign 1.2.0 (98a6bb36)",
    "schema_version": "0.7.0"
  },
  "timelines": [
    {
      "children": {},
      "class": "ContinuousPhysicalTimeline",
      "conversion_maps": [],
      "flow_control": {
        "breaks": [],
        "jumps": [],
        "markers": []
      },
      "id": "cpt_1",
      "is_segment_line": false,
      "length": {
        "number_type": "float",
        "unit": "seconds",
        "value": 788.0
      },
      "locked": false,
      "measure_map": null,
      "meta": {},
      "metric_hierarchy": null,
      "name": "Form (Harnoncourt)",
      "number_type": "float",
      "regions": [],
      "unit": "seconds"
    },
    {
      "children": {},
      "class": "ContinuousPhysicalTimeline",
      "conversion_maps": [],
      "flow_control": {
        "breaks": [],
        "jumps": [],
        "markers": []
      },
      "id": "cpt_2",
      "is_segment_line": false,
      "length": {
        "number_type": "float",
        "unit": "seconds",
        "value": 788.0
      },
      "locked": false,
      "measure_map": null,
      "meta": {},
      "metric_hierarchy": null,
      "name": "Themen",
      "number_type": "float",
      "regions": [],
      "unit": "seconds"
    },
    {
      "children": {},
      "class": "ContinuousPhysicalTimeline",
      "conversion_maps": [],
      "flow_control": {
        "breaks": [],
        "jumps": [],
        "markers": []
      },
      "id": "cpt_3",
      "is_segment_line": false,
      "length": {
        "number_type": "float",
        "unit": "seconds",
        "value": 788.0
      },
      "locked": false,
      "measure_map": null,
      "meta": {},
      "metric_hierarchy": null,
      "name": "Topik",
      "number_type": "float",
      "regions": [],
      "unit": "seconds"
    },
    {
      "children": {},
      "class": "ContinuousPhysicalTimeline",
      "conversion_maps": [],
      "flow_control": {
        "breaks": [],
        "jumps": [],
        "markers": []
      },
      "id": "cpt_4",
      "is_segment_line": false,
      "length": {
        "number_type": "float",
        "unit": "seconds",
        "value": 788.0
      },
      "locked": false,
      "measure_map": null,
      "meta": {},
      "metric_hierarchy": null,
      "name": "Takte",
      "number_type": "float",
      "regions": [],
      "unit": "seconds"
    },
    {
      "children": {},
      "class": "ContinuousPhysicalTimeline",
      "conversion_maps": [],
      "flow_control": {
        "breaks": [],
        "jumps": [],
        "markers": []
      },
      "id": "cpt_5",
      "is_segment_line": false,
      "length": {
        "number_type": "float",
        "unit": "seconds",
        "value": 788.0
      },
      "locked": false,
      "measure_map": null,
      "meta": {},
      "metric_hierarchy": null,
      "name": "Tempo",
      "number_type": "float",
      "regions": [],
      "unit": "seconds"
    },
    {
      "children": {},
      "class": "ContinuousPhysicalTimeline",
      "conversion_maps": [],
      "flow_control": {
        "breaks": [],
        "jumps": [],
        "markers": []
      },
      "id": "cpt_6",
      "is_segment_line": false,
      "length": {
        "number_type": "float",
        "unit": "seconds",
        "value": 788.0
      },
      "locked": false,
      "measure_map": null,
      "meta": {},
      "metric_hierarchy": null,
      "name": "Dramaturgie",
      "number_type": "float",
      "regions": [],
      "unit": "seconds"
    },
    {
      "children": {},
      "class": "ContinuousPhysicalTimeline",
      "conversion_maps": [],
      "flow_control": {
        "breaks": [],
        "jumps": [],
        "markers": []
      },
      "id": "cpt_7",
      "is_segment_line": false,
      "length": {
        "number_type": "float",
        "unit": "seconds",
        "value": 788.0
      },
      "locked": false,
      "measure_map": null,
      "meta": {},
      "metric_hierarchy": null,
      "name": "Partitur (PDF)",
      "number_type": "float",
      "regions": [],
      "unit": "seconds"
    }
  ]
}
